법률분류,기본질문,기본답변
주택·상가임대차>주택임대차>임대차기간및종료에관한분쟁(갱신청구권포함)>Ⅱ.묵시적갱신,묵시적으로 갱신된 경우의 주택임대차기간,"임대차계약이 묵시적으로 갱신된 경우라고 하더라도 임차인은 언제든지 계약을 해지할 수 있고, 계약 해지 통지로부터 3개월 후에 계약이 해지되게 됩니다."
주택·상가임대차>주택임대차>임대차기간및종료에관한분쟁(갱신청구권포함)>Ⅱ.묵시적갱신,원룸계약 파기 문의드려요.,"주택임대차보호법상 임차인은 계약기간만료 1개월전까지 통지하지 아니한 경우 묵시적으로 갱신되는 것으로 보고, 묵시적갱신의 경우는 임대인이 해지통지를 받은 날부터 3개월이 지나면 효력이 발생하는 것으로 되어 있습니다.또한, 동법은 이른바 '편면적 강행규정'으로 동법에 위반된 약정으로서 임차인에게 불리한 것을 효력이 없는 것으로 합니다.따라서, 님은 주택임대차보호법에 근거하여 계약만료1달전에 해지통지를 한 것으로 적법하게 해지되었고, 임대차계약서상의 두달전 통보규정은 임차인에게 불리한 약정으로 효력이 없다고 할 것입니다.다음의 주택임대차보호법 조문을 참조하세요.제6조(계약의 갱신) ① 임대인이 임대차기간이 끝나기 6개월 전부터 1개월 전까지의 기간에 임차인에게 갱신거절(更新拒絶)의 통지를 하지 아니하거나 계약조건을 변경하지 아니하면 갱신하지 아니한다는 뜻의 통지를 하지 아니한 경우에는 그 기간이 끝난 때에 전 임대차와 동일한 조건으로 다시 임대차한 것으로 본다. 임차인이 임대차기간이 끝나기 1개월 전까지 통지하지 아니한 경우에도 또한 같다.제6조의2(묵시적 갱신의 경우 계약의 해지) ① 제6조제1항에 따라 계약이 갱신된 경우 같은 조 제2항에도 불구하고 임차인은 언제든지 임대인에게 계약해지(契約解止)를 통지할 수 있다. <개정 2009.8.>② 제1항에 따른 해지는 임대인이 그 통지를 받은 날부터 3개월이 지나면 그 효력이 발생한다.제10조(강행규정) 이 법에 위반된 약정(約定)으로서 임차인에게 불리한 것은 그 효력이 없다."
주택·상가임대차>주택임대차>임대차기간및종료에관한분쟁(갱신청구권포함)>Ⅱ.묵시적갱신,임대기간 만료와 계약의 갱신,임차주택을 비워 줄 의무가 없습니다. 그 이유는 임대인이 계약이 묵시적으로 갱신되는 것을 막기 위하여는 임차인인 귀하에게 임대기간 만료시의 명도 또는 계약갱신거절의 통지를 임대 기간 만료 전 6월부터 1월까지 사이에 하여야 하는데 이를 하지 않았기 때문입니다. 따라서 귀하의 경우에는 계약이 종전과 동일한 조건으로 묵시적으로 갱신되었기 때문에 앞으로 2년간 임차인으로 계속 점유를 할 수 있습니다. 다만 귀하가 임대기간이 끝날 당시에 차임의 지급을 2번 이상 연체하거나 임차주택에서 마약 제조를 하는 등 주거 이외의 목적으로 사용하는 등 임차인으로서의 의무를 현저하게 위반한 경우에는 보호받을 수 없습니다.
주택·상가임대차>주택임대차>임대차기간및종료에관한분쟁(갱신청구권포함)>Ⅱ.묵시적갱신,임대차 계약이 묵시적 갱신이 된 후 임차인이 계약 해지통보를 하였습니다. 그런데 임대인 乙은 계약이 묵시적 갱신이 된 것이므로 임차인 甲 보고 새로운 임차인을 구하고 나가라고 합니다. 이처럼 임대인이 새로운 임차인과 임대차계약을 체결함에 있어 발생하는 중개수수료는 누가 부담해야 하나요?,"임대차계약이 묵시적 갱신이 된 경우 임차인은 언제든지 임대인에게 계약해지(契約解止)를 통지할 수 있고(주택임대차보호법 제6조의 2 제1항), 임대인이 그 통지를 받은 날부터 3개월이 지나면 해지의 효력이 발생합니다(동조 제2항).  따라서 이러한 해지권은 임차인의 권리로 인정되는 것이기에 이후 임대인이 새로운 임차인을 구하기 위한 부동산 중개수수료를 임차인이 부담하여야 할 의무는 없습니다.  국토교통부 역시 묵시적 갱신 후 계약해지의 중개수수료의 부담주체에 관하여 법제처 법령해석에 따라 임차건물의 중개의뢰인이 임대인과 새로운 임차인으로 되는 것이므로 임대인과 새로운 임차인이 중개수수료 부담주체라고 해석한 바 있습니다. "
주택·상가임대차>주택임대차>임대차기간및종료에관한분쟁(갱신청구권포함)>Ⅱ.묵시적갱신,임대차계약이 갱신된 경우 종전의 대항력과 우선변제권의 효력,"대항력과 우선변제권을 갖춘 주택임대차계약이 갱신된 경우, 종전 보증금의 범위 내에서 최초 임대차계약에 의한 대항력과 우선변제권이 그대로 유지된다고 할 것입니다."
주택·상가임대차>주택임대차>임대차기간및종료에관한분쟁(갱신청구권포함)>Ⅱ.묵시적갱신,임대차계약이 묵시적 갱신된 후 해지된 경우 새로운 임대차의 중개수수료 부담 주체,주택임대차보호법상 묵시적 갱신 후 임차인에게 해지권을 인정하고 있기 때문에 임대인이 새로운 임차인을 구하기 위한 부동산 중개수수료를 임차인이 부담할 의무가 없다고 볼 수 있습니다.
주택·상가임대차>주택임대차>임대차기간및종료에관한분쟁(갱신청구권포함)>Ⅱ.묵시적갱신,임대차기간 종료 직전에 한 해지통지의 효력 발생시점,"상대방이 묵시적 갱신된 임대차계약을 바로 해지하겠다는 통지를 하였더라도 귀하는 3개월 동안은 약속한 차임을 받을 수 있고, 그 기간 동안 임대차계약이 존속됨을 주장하실 수 있습니다"
주택·상가임대차>주택임대차>임대차기간및종료에관한분쟁(갱신청구권포함)>Ⅱ.묵시적갱신,"임차인 甲과 임대인 乙은 임대차 기간 1년의 주택임대차 계약을 체결하였는데, 甲이 1년이 지나도 임대차계약의 종료를 주장하지 않은 채 계속 거주하다가 묵시적 갱신이 되었음을 이유로 주택임대차보호법 제6조의 2에 따라 임대차계약의 해지를 주장할 수 있을까요?","주택임대차보호법 제4조 제1항은 “기간을 정하지 아니하거나 2년 미만으로 정한 임대차는 그 기간을 2년으로 본다. 다만, 임차인은 2년 미만으로 정한 기간이 유효함을 주장할 수 있다.”라고 규정하고 있습니다. 즉, 이 법 규정에 따라 2년 미만으로 정한 임대차는 임차인이 그 기간을 주장하지 않으면 그 기간이 2년이 된다고 보아야 합니다.이와 관련하여 우리 대법원 판례 역시 “임차인이 주택임대차보호법 제4조 제1항 의 적용을 배제하고 2년 미만으로 정한 임대차기간의 만료를 주장할 수 있는 것은 임차인 스스로 그 약정 임대차 기간이 만료되어 임대차가 종료되었음을 이유로 그 종료에 터잡은 임차보증금 반환채권 등의 권리를 행사하는 경우에 한정되고, 임차인이 2년 미만의 약정 임대차기간이 만료되고 다시 임대차가 묵시적으로 갱신되었다는 이유로 같은 법 제6조 제1항 , 제4조 제1항 에 따른 새로운 2년간의 임대차의 존속을 주장하는 경우까지 같은 법이 보장하고 있는 기간보다 짧은 약정 임대차기간을 주장할 수는 없다.”고 판시하였습니다(대법원 1996. 4. 26. 선고 96다5551, 5568 판결).  따라서 위 법리에 따를 때 약정 임대차 기간 1년이 지나도록 임차인이 임대차의 종료를 주장하지 않았다면 그 임대차가 묵시적 갱신이 되는 것이 아니라 임대차 기간이 2년으로 정해지는 것이고, 따라서 임차인이 묵시적 갱신을 전제로 하는 주택임대차보호법 제6조의 2에 따른 임대차계약의 해지를 할 수는 없을 것으로 사료됩니다."
주택·상가임대차>주택임대차>임대차기간및종료에관한분쟁(갱신청구권포함)>Ⅱ.묵시적갱신,"저는 甲에게 2,500만원을 빌려주었으나 받지 못하고 있던 중 甲이 乙에 대하여 가지는 전세보증금반환청구채권 2,500만원을 양도받았고, 甲이 乙에게 그 사실을 내용증명우편으로 통지하도록 하였습니다. 그러나 甲과 乙은 계약기간 2년이 만료된 후 전세(임대차)기간을 연장하여 계약갱신을 하였는바, 제가 위 양수금을 지급 받기 위해서는 갱신된 계약기간이 만료되어야 하는지요?","전세보증금반환청구채권은 전세계약당사자로부터 분리하여 양도할 수 있고(대법원 1969. 12. 23. 선고 69다1745 판결), 양도인 甲이 乙에게 내용증명우편으로 양도통지를 하였으므로 귀하는 乙에 대하여는 위 채권양도를 주장할 수 있다고 할 것입니다. (민법 제449조, 제450조.)  그런데 甲과 乙이 계약기간만료 후 계약을 갱신하였으므로 그 효력이 귀하에게도 미치는지 문제되는 바, 판례를 보면, “임대인이 임차보증금반환청구채권의 양도통지를 받은 후에 임대인과 임차인 사이에 임대차계약의 갱신(更新)이나 계약기간연장에 관하여 명시적 또는 묵시적 합의가 있더라도 그 합의의 효과는 보증금반환채권의 양수인에 대하여는 미칠 수 없다.”라고 하였습니다.(대법원 1989. 4. 25. 선고 88다카4253, 4260 판결).  따라서 귀하는 甲과 乙이 임대차계약을 갱신하였다고 하여도 종전계약기간이 만료되었음을 이유로 양수금청구가 가능할 것이다. 임대인 乙은 주택의 명도와 전세보증금반환의 동시이행을 주장할 수 있으므로, 甲이 위 주택을 명도하지 않고 있다면 귀하가 乙의 채권자로서 乙의 주택명도청구권을 대위행사 하여 甲에게 위 주택의 명도청구소송을 할수 있는지가 문제인데, 위 판례는 채권자가 자기채권을 보전하기 위하여 채무자의 권리를 행사하려면 채무자의 무자력을 요건으로 하는 것이 통상이지만, 임차보증금반환채권을 양수한 채권자가 그 이행을 청구하기 위하여 임차인의 가옥명도가 선행되어야 할 필요가 있어서 그 명도를 구하는 경우에는 그 채권의 보전과 채무자인 임대인의 자력유무는 관계없는 일이므로 무자력을 요건으로 한다고 할 수 없다고 하였습니다. (대법원 1989. 4. 25. 선고 88다카4253, 4260 판결  따라서 귀하는 甲을 상대로 위 주택의 대위명도소송을 제기하여 승소판결 받아 강제집행 한 후 乙에게 양수금청구를 하면 될 것으로 보입니다."
주택·상가임대차>주택임대차>임대차기간및종료에관한분쟁(갱신청구권포함)>Ⅱ.묵시적갱신,"저는 임차주택을 임차보증금 5,000만원에 계약기간 2년으로 정한 임대차계약을 체결하고 거주하였습니다. 그런데 집주인은 위 임대차기간이 만료할 당시에는 아무런 의사표시를 하지 않고 있다가, 약정된 임대차기간이 만료한 후 6개월이 경과한 지금에서야, 저에게 위 주택을 자기가 사용하여야 한다고 하면서 위 주택의 명도를 요구합니다. 이 경우 저는 위 주택을 집주인에게 명도 해야 하는지요?","계약의 갱신에 관하여 「주택임대차보호법」 제6조 제1항 및 제2항은 “①임대인이 임대차기간이 끝나기 6개월 전부터 1개월 전까지의 기간에 임차인에게 갱신거절(更新拒絶)의 통지를 하지 아니하거나 계약조건을 변경하지 아니하면 갱신하지 아니한다는 뜻의 통지를 하지 아니한 경우에는 그 기간이 끝난 때에 전 임대차와 동일한 조건으로 다시 임대차한 것으로 본다. 임차인이 임대차기간이 끝나기 1개월 전까지 통지하지 아니한 경우에도 또한 같다. ②제1항의 경우 임대차의 존속기간은 2년으로 본다.”라고 규정하고 있고, 같은 법 제4조 제1항은 “기간의 정함이 없거나 기간을 2년 미만으로 정한 임대차는 그 기간을 2년으로 본다. 다만, 임차인은 2년 미만으로 정한 기간이 유효함을 주장할 수 있다.”라고 규정하고 있습니다.그러므로 「주택임대차보호법」상 묵시적으로 갱신된 주택임대차의 존속기간은 2년이므로, 묵시적으로 갱신된 주택임대차의 존속기간은 2년으로 보아야 할 것입니다.판례도 “주택임대차보호법 제6조 제1항에 따라 임대차계약이 묵시적으로 갱신되면 그 임대차기간은 같은 법 제6조 제2항, 제4조 제1항에 따라 2년으로 된다.”라고 하였습니다(대법원 2002. 9. 24. 선고 2002다41633 판결, 1992. 1. 17. 선고 91다25017 판결).따라서 귀하는 1년 6개월은 더 거주할 수 있을 것으로 보입니다.참고로 같은 법 제6조의2 제1항 및 제2항은 “제6조제1항에 따라 계약이 갱신된 경우 같은 조 제2항에도 불구하고 임차인은 언제든지 임대인에게 계약해지(契約解止)를 통지할 수 있다.제1항에 따른 해지는 임대인이 그 통지를 받은 날부터 3개월이 지나면 그 효력이 발생한다.”라고 규정하여 묵시적으로 갱신된 주택임대차에서 임대인이 해지를 원할 경우와 임차인이 해지를 원할 경우를 다르게 규정하고 있습니다."
주택·상가임대차>주택임대차>임대차기간및종료에관한분쟁(갱신청구권포함)>Ⅱ.묵시적갱신,저는 주택임차인인데 집주인으로부터 임대기간이 끝나기 불과 몇 일전에 임대보증금을 인상하여 주거나 그것이 불가능하면 기간 만료와 동시에 집을 비워 달라는 통고를 받았습니다. 임대기간이 끝나면 반드시 집을 비워 주어야 하는지요?,임차주택을 비워 줄 의무가 없습니다. 그 이유는 임대인이 계약이 묵시적으로 갱신되는 것을 막기 위하여는 임차인인 귀하에게 임대기간 만료시의 명도 또는 계약갱신거절의 통지를 임대 기간 만료 전 6월부터 2월까지 사이에 하여야 하는데 이를 하지 않았기 때문입니다. 따라서 귀하의 경우에는 계약이 종전과 동일한 조건으로 묵시적으로 갱신되었기 때문에 앞으로 2년간 임차인으로 계속 점유를 할 수 있습니다. 다만 귀하가 임대기간이 끝날 당시에 차임의 지급을 2번 이상 연체하거나 임차주택에서 마약 제조를 하는 등 주거 이외의 목적으로 사용하는 등 임차인으로서의 의무를 현저하게 위반한 경우에는 보호받을 수 없습니다.
주택·상가임대차>주택임대차>임대차기간및종료에관한분쟁(갱신청구권포함)>Ⅱ.묵시적갱신,전세금 반환 관련 문의드려요.  5월까지 계약연장하는 것에 대한 부분은 따로 계약서를 쓰지 않았다고 했는데 이게 혹 나중에 문제가 될까요?,"이 역시 묵시적갱신으로 볼 수 있는데, 묵시적갱신기간동안 해지통지를 하면 3개월후에 해지의 효력이 발생합니다."
주택·상가임대차>주택임대차>임대차기간및종료에관한분쟁(갱신청구권포함)>Ⅱ.묵시적갱신,"전세금 반환 관련 문의드려요.  처음 계약한 이후 전세권 설정 연장이나, 전입신고를 연장하지않았는데 이건 상관없나요?지금이라도따로 해야할까요?","네, 상관없습니다. 묵시적갱신이 된 것입니다."
주택·상가임대차>주택임대차>임대차기간및종료에관한분쟁(갱신청구권포함)>Ⅱ.묵시적갱신,"주택임대차계약이 갱신된 경우, 대항력과 우선변제권의 범위","임대차계약이 갱신된 경우에도 종전 보증금의 범위 내에서는 최초 임대차계약에 의한 대항력과 우선변제권이 그대로 유지되므로, 500만원에 대해서는 최초 대항력이 유지되고, 증액된 100만원에 대해서는 요건을 갖추면 증액된 시점에서의 대항력과 우선변제권을 갖출 수 있을 것으로 보입니다."
주택·상가임대차>주택임대차>임대차기간및종료에관한분쟁(갱신청구권포함)>Ⅱ.묵시적갱신,"집기파손, 관리비 미납을 이유로 갱신된 임대차계약기간의 중도에 임대차계약을 해지할 수 있지","임대차계약에 있어서 임대차보증금은 임대차계약 종료 후 목적물을 임대인에게 인도할 때까지 발생하는 임대차에 관한 임차인의 모든 채무를 담보합니다. 따라서 그 피담보채무 상당액은 임대차관계의 종료 후 목적물이 반환될 때에 특별한 사정이 없는 한 별도의 의사표시 없이 보증금에서 당연히 공제되는 것이므로 임대인은 임대차보증금에서 그 피담보채무를 공제한 나머지만을 임차인에게 반환할 의무가 있습니다. 그리고 임차인이 임대차목적물을 사용·수익하는 동안 그 사용·수익을 위하여 그 목적물에 관하여 발생한 관리비·수도료·전기료 등 용익에 관한 채무는 임대차계약에서 달리 약정하였다는 등의 특별한 사정이 없는 한 임대차관계의 성질상 임대차보증금에 의하여 담보되는 임차인의 채무에 속한다고 할 것이라는 것이 판례의 입장입니다(대법원 2012. 6. 28. 선고 2012다19154 판결, 대법원 2005. 9. 28. 선고 2005다8323, 8330 판결 등 참조).  한편, 「주택임대차보호법」 제6조는 제1항은 “임대인이 임대차기간이 끝나기 6개월 전부터 1개월 전까지의 기간에 임차인에게 갱신거절(更新拒絶)의 통지를 하지 아니하거나 계약조건을 변경하지 아니하면 갱신하지 아니한다는 뜻의 통지를 하지 아니한 경우에는 그 기간이 끝난 때에 전 임대차와 동일한 조건으로 다시 임대차한 것으로 본다. 임차인이 임대차기간이 끝나기 1개월 전까지 통지하지 아니한 경우에도 또한 같다”라고 규정하고 있고, 같은 조 제2항은 “제1항의 경우 임대차의 존속기간은 2년으로 본다.”라고 규정하고 있습니다. 다만 같은 조 제3항은 “2기(期)의 차임액(借賃額)에 달하도록 연체하거나 그 밖에 임차인으로서의 의무를 현저히 위반한 임차인에 대하여는 제1항을 적용하지 아니한다”고 합니다. 따라서 사안의 경우 乙은 임대차 목적물인 아파트를 고의로 파손한바, 임차물보관의무를 현저히 위반한 경우에 해당하여 「주택임대차보호법」 제6조 제1항이 적용되지 않습니다. 귀하는 즉시 乙에게 내용증명이나 문자메시지 등으로 임대차계약 해지통지를 하여 아파트에서 나갈 것을 요구할 수 있고, 을이 아파트를 인도해 주면 그와 동시에 연체된 관리비와 방문, 부엌 집기 수리비 등을 공제한 나머지 임대차보증금만 돌려주면 될 것으로 생각됩니다."
주택·상가임대차>주택임대차>임대차기간및종료에관한분쟁(갱신청구권포함)>Ⅱ.묵시적갱신,집주인으로부터 임대기간이 끝나기 불과 몇 일전에 임대보증금을 인상하여 주거나 그것이 불가능하면 기간 만료와 동시에 집을 비워 달라는 통고를 받았습니다.임대기간이 끝나면 반드시 집을비워주어야 하는지요,임차주택을 비워 줄 의무가 없습니다. 그 이유는 임대인이 계약이 묵시적으로 갱신되는 것을 막기 위하여는 임차인인 귀하에게 임대기간 만료시의 명도 또는 계약갱신거절의 통지를 임대 기간 만료 전 6월부터 1월까지 사이에 하여야 하는데 이를 하지 않았기 때문입니다. 따라서 귀하의 경우에는 계약이 종전과 동일한 조건으로 묵시적으로 갱신되었기 때문에 앞으로 2년간 임차인으로 계속 점유를 할 수 있습니다. 다만 귀하가 임대기간이 끝날 당시에 차임의 지급을 2번 이상 연체하거나 임차주택에서 마약 제조를 하는 등 주거 이외의 목적으로 사용하는 등 임차인으로서의 의무를 현저하게 위반한 경우에는 보호받을 수 없습니다.
주택·상가임대차>주택임대차>임대차기간및종료에관한분쟁(갱신청구권포함)>Ⅲ.갱신요구권,개정법 시행 당시 기간 만료 1달이 채 남지 않은 임대차계약에 적용여부,"2020. 8. 15. 종료되는 임대차계약의 임차인인 갑 등이 2020. 7. 9. 및 2020. 7. 31. 임대인에게 계약갱신을 요구하였는데, 이에 따라 임대차계약이 주택임대차보호법 제6조의3에 따른 갱신요구로 갱신되었는지 문제 된 사안에서, 2020. 7. 31. 법률 제17470호로 개정된 주택임대차보호법에서 신설한 제6조의3 제1항(이하 ‘개정규정’이라고 한다)은 부칙(2020. 7. 31.) 제2조 제1항에 따라 개정법 시행 당시 존속 중인 임대차에 대하여도 적용되므로 2020. 8. 15. 종료되는 위 임대차계약에도 개정규정이 적용되나, 개정규정은 제6조 제1항 전단의 기간, 즉 임대차기간이 끝나기 6개월 전부터 1개월 전까지의 기간 이내에 계약갱신을 요구할 경우 적용되는 것이므로, 갑 등이 위 기간이 지난 후인 2020. 7. 31. 계약갱신을 요구한 것은 효력이 없고, 위 기간 내인 2020. 7. 9. 계약갱신을 요구한 것은 개정규정 시행 전의 사실행위로서 개정규정에 따른 계약갱신 요구로 볼 수 없습니다(대법원 2021다263229 판결 참조)."
주택·상가임대차>주택임대차>임대차기간및종료에관한분쟁(갱신청구권포함)>Ⅲ.갱신요구권,임대인이 법인인 경우 실거주 목적 계약갱신거절 가부,"부동산 매매, 임대, 전대업 등을 영위하는 주식회사인 임대인이 임차목적물인 아파트를 사무실 및 사택으로 사용할 예정이므로 개정 주택임대차보호법 제6조의3 제1항 단서 제8호에서 규정한 ‘임대인이 목적 주택에 실제 거주하려는 경우’에 해당하여 갱신요구를 거절할 정당한 있다고 주장하는 것에 대해 ① 임대인은 부동산 매매, 임대, 전대업 등을 영위하는 주식회사(법인)인바, 법인이 목적 주택을 사무실로 사용하는 것을 그 법인이 해당 주택에서 ‘거주’하고 있다고 볼 수 없는 점, ② 해당 주택을 법인이 사택으로 사용하게 될 경우 그 주택에서 실제로 거주하는 것은 임대인인 법인이 아니라 그 법인의 임직원이라 할 것인데 주택임대차보호법 제6조의3 제1항 제8호는 임대인 자신이나 그 직계존속 또는 직계비속이 목적 주택에 거주하는 경우를 규정하고 있는바, 법인인 임대인의 임직원이 목적 주택에 거주하는 것을 규정하고 있지는 않은 점, ③ 더욱이 위 주택임대차보호법 제6조의3 제1항 제8호에서 임대인뿐만 아니라 그 직계존속 또는 직계비속이 실거주하는 경우를 포함하고 있는바, 이는 임대인이 자연인임을 전제로 하고 있다고 보이는 점, ④ 법무부·국토교통부에서 발간한 2020. 7. 31. 개정 주택임대차보호법 해설집에도 ‘법인이 주택임대차보호법에 따른 실거주를 할 수 있는 대상으로 보기 어렵기 때문에 법인이 임대인인 경우 직접 거주를 이유로 갱신거절은 불가능하다’는 유권해석을 내린 점 등에 비추어 보면 법인인 임대인은 주택임대차보호법 제6조의3 제1항 단서 제8호에서 규정한 실거주를 이유로 피고들의 계약갱신요구를 거절할 수 없다고 본 하급심 판결이 있습니다(서울북부 2021가단104419 판결 참조)."
주택·상가임대차>주택임대차>임대차기간및종료에관한분쟁(갱신청구권포함)>Ⅲ.갱신요구권,임차인의 계약갱신요구에 의해 갱신되었으나 임대차기간을 명시한 경우 주택임대차보호법 제6조의3 제4항에 따라 임차인의 해지 가부,"주택임대차법 제6조의3 제4항에 따라 계약갱신요구에 의하여 임대차가 갱신된 경우에도 준용되는 주택임대차법 제6조의2는 조문의 체계 및 그 문언의 취지상 임대차가 별도의 기간을 정함이 없이 갱신된 경우에 한하여 적용되므로 설령 신규 임대차계약이 형식만 재계약일 뿐 계약갱신요구권에 따른 갱신의 실질을 갖는 것으로 평가할 수 있다고 하더라도, 신규 임대차계약에서 임대차기간을 2023. 4. 5.까지로 명시적으로 정한 이상 원고가 주택임대차법 제6조의2에 따라 일방적으로 임대차계약을 해지할 수 있다고 볼 수도 없다고 한 하급심 판례가 있습니다(서울북부지방법원 2022가합21044 판결 참조)."
