법률분류,기본질문,기본답변
개인회생>신청서작성및첨부서류>신청서(변제계획안등)작성및변경(수정)>Ⅱ.변제계획안작성의기준,가용소득과 관련한 월평균 소득의 산정은 어떻게 하는지,"개인회생제도는 그 제도의 본질상 정기적이고 계속·반복적인 수입가능성을 인정할 수 있어야 하며 이에 「채무자 회생 및 파산에 관한 법률」은 정기적이고 확실한 수입을 얻을 가능성 있는 급여소득자 또는 장래 계속적으로 또는 반복하여 수입을 얻을 가능성 있는 영업소득자가 개인회생을 신청할 수 있도록 규정하고 있습니다(같은 법 제579조 제1, 2, 3호). 급여소득자에는 아르바이트, 파트타임 종사자, 비정규직, 일용직 등 그 고용형태와 소득신고의 유무에 불구하고 정기적이고 확실한 수입을 얻을 가능성이 있는 모든 개인을 포함하며(「개인회생사건 처리지침」제7조의2 제1항), 영업소득자에는 소득신고의 유무에 불구하고 수입을 장래에 계속적으로 또는 반복하여 얻을 가능성이 있는 모든 개인을 포함하도록 규정하고 있습니다(같은 지침 제7조의2 제2항).위와 같은 급여소득자 또는 영업소득자가 변제기간 동안 계속적이고 반복적으로 수령할 수 있는 월 평균 소득 중에서 각종 제세공과금과 채무자 및 피부양자의 생활에 필요한 생계비를 공제한 나머지 금액을 가용소득이라고 하고(같은 법 제579조 제4호), 채무자는 가용소득으로 변제기간 동안 개인회생채권자들에게 변제하는 것을 내용으로 하여 변제계획안을 작성하여 법원으로부터 인가를 받아 이를 수행하게 됩니다.급여소득자의 월 평균 소득은 매월 수령하는 급여 및 특정 월에만 수령하는 상여금, 성과급 등을 합산한 금액을 평균하여 산정하며 이는 사용자가 발행한 급여명세서나 근로소득원천징수영수증, 급여통장의 기재로 이를 계산할 수 있습니다. 원칙적으로 최근 1년간 직장의 변동이 없는 경우에는 1년간의 실제 소득액을 평균한 월 평균 소득을 기초로 하여 산정하고, 최근 1년간 직장의 변동이 있는 경우에는 직장 변동 이후의 실제 소득액을 평균한 월평균 소득을 기초로 산정합니다(「개인회생사건 처리지침」제7조 제1항 제1호). 다만, 근무기간이 1년 미만인 경우에는 해당 기간 동안의 실제 소득액을 평균한 월 평균 소득을 기초로 산정해야 할 것이나, 정기적이고 확실한 수입을 얻을 가능성에 대해 소명할 필요가 있습니다. 급여소득자의 가용소득을 산정하기위해 월평균 소득에서 공제되는 세금 등은 소득세·주민세·건강보험료·국민연금보험료·고용보험료 등이 있으며(같은 법 제579조 제4호 나목, 같은 법 시행령 제17조), 실무상 노동조합 회비도 이를 공제하기도 합니다. 공무원, 군인, 사립학교 교원의 경우 공무원연금 기여금, 군인연금 기여금, 사립학교교직원연금 기여금은 위 국민연금 보험료에 해당하므로 역시 공제될 수 있습니다.영업소득자의 월 평균 소득은 소득신고서, 소득금액증명원, 영업장부 등을 기초로 최근 1년간의 소득을 평균한 연간 소득금액에서 소득세·주민세·건강보험료·국민연금보험료·고용보험료·산업재해보상보험료와 영업의 경영보존 및 계속을 위하여 필요한 비용을 공제한 순소득액을 산출하여 이를 월 평균수입으로 환산하여 산정합니다(같은 법 제579조 제4호 나, 라목, 같은 법 시행령 제17조). 영업소득자의 경우 신고소득을 신빙하기 어려운 경우가 많으므로 법원은 신고소득의 성실성을 판단하기 위해 최근의 고용형태별근로실태조사보고서의 유사직종 부분 사본을 제출하게 하고 있습니다. 최근 1년간 직업의 변동이 있는 경우에는 직업 변동 이후의 실제 소득액을 평균한 월평균 소득을 기초로 산정합니다(「개인회생사건 처리지침」제7조 제1항 제1호). 영업기간이 1년 미만인 경우에는 해당 기간 동안의 실제 소득액을 평균한 월 평균 소득을 기초로 산정해야 할 것이나, 계속적이고 반복하여 수입을 얻을 가능성에 대해 소명할 필요가 있습니다. 급여소득자 또는 영업소득자임을 증명하는 자료는 개인회생절차개시신청서에 필요적으로 첨부해야 하는 서류이나(같은 법 제589조 제2항 제4호), 영세업체에 근무하거나 급여를 현금으로 수령하는 등으로 인해 정기적인 수입이 있음에도 불구하고 이를 소명할 자료가 없는 경우가 있을 수 있습니다. 급여소득자의 경우 ‘소득증명서’(법원양식 : 대법원 인터넷 홈페이지 또는 법원 파산과에서 이를 얻을 수 있음)에 고용주로부터 근무기간 및 월평균소득 등에 대하여 확인 받고 사업자등록증 사본을 첨부하여 소득을 증명할 수 있고, 사업자등록이 되어 있지 않을 경우 고용주의 인감증명서·주민등록등본 등을 첨부합니다. 영업소득자의 경우 소득을 신고하지 않는 등으로 인하여 소명자료를 제출할 수 없는 경우, ①고용형태별근로실태조사보고서상의 유사직종의 통계소득을 기초로 산정할 수 있고(「개인회생사건 처리지침」제7조 제1항 제2호), ②‘소득진술서’(법원양식)에 스스로 월평균 소득을 진술하고 거래처 대표나 지인 등 2인 이상으로부터 이를 보증하는 내용의 ‘확인서’(법원양식)와 확인자의 사업자등록증이나 인감증명서를 첨부하며 신청인이 영업소득자로서 사업자등록이 되어 있는 경우 사업자등록증 사본을 추가로 첨부합니다. 법원 또는 개인회생위원은 신청인이 제출한 소득에 관한 자료를 기초로 채무자의 소득에 관한 조사를 하며 언제든지 채무자에게 금전의 수입과 지출 그 밖에 채무자의 재산상의 업무에 관하여 보고를 요구할 수 있고, 필요하다고 인정하는 경우에는 재산상황의 조사, 시정의 요구 기타 적절할 조치를 취할 수 있고(같은 법 제591조), 신청인이 정당한 사유 없이 이러한 보고 등을 거부하거나 허위보고를 한 경우 1년 이하의 징역 또는 1천만원 이하의 벌금의 형으로 처벌될 수 있습니다(같은 법 제649조 제5호). 통상적으로 소득에 관한 자료가 부실하거나 내용이 일부 누락되는 등으로 신빙성이 없다고 판단될 경우 ‘수입상황 보고요구서 및 수입상황 보고서’(법원양식)를 통해 위와 같은 사실을 경고하고 수입상황을 보고하도록 할 수 있으며, 특히 영업소득자의 경우 개인회생위원은 영업 수지표를 작성하여 그에 따른 월평균수입을 소명하도록 요청하는 경우가 많습니다. 개인회생제도에 있어서 ‘수입’이란 반드시 근로의 대가일 필요는 없으며 계속적으로 또는 반복적으로 얻을 가능성이 있으면 개인회생을 신청할 수 있습니다. 「채무자 회생 및 파산에 관한 법률」도 “급여소득자”를 “급여·연금 그 밖에 이와 유사한 정기적이고 확실한 수입을 얻을 가능성이 있는 개인”이라고 정의하여(같은 법 제579조 제2호), 연금소득자도 개인회생을 신청할 수 있음을 인정하고 있습니다. 일반적으로 개인회생을 신청할 수 있는 연금소득자로서는 공무원·군인·사립학교교직원으로서 퇴직연금을 수령하는 자나 사보험이나 국민연금의 보험금을 수령하는 자 등으로서 수령하는 연금액이 생계비 이상인 자인 경우에만 개인회생을 신청할 수 있습니다. 따라서 최소한의 생계유지를 위해 국가로부터 생계비를 지원 받는 기초생활보장수급자나 「장애인복지법」에 따른 장애수당 등의 수급자는 원칙적으로 연금소득자로서 개인회생을 신청하기는 어렵습니다."
개인회생>신청서작성및첨부서류>신청서(변제계획안등)작성및변경(수정)>Ⅱ.변제계획안작성의기준,가용소득이란 무엇인가요?,"○ 가용소득이란 채무자가 수령하는 소득의 총액에서 소득세?주민세?건강보험료 그 밖에 이에 준하는 금액과 채무자 및 그 피부양자의 생활에 필요한 생계비를 공제한 나머지 처분 가능한 소득을 말합니다. 다만 가용소득은 장래에도 계속적, 정기적으로 발생할 가능성이 있는 수입이어야만 합니다. ○ 채무자의 소득은 다음의 방법으로 산정하되 특별한 사정이 있는 경우에는 증감할 수 있습니다.  ① 최근 1년간 직장의 변동이 없는 경우에는 1년간의 실제 소득액을 평균한 월평균 소득을 기초로 하여 산정하고, 직장의 변동이 있는 경우에는 직장 변동 이후의 실제 소득액을 평균한 월평균 소득을 기초로 하여 산정합니다.  ② 영업소득자가 그 소득에 관한 소명자료가 없는 경우에는 임금구조기본통계조사보고서 등의 통계소득을 기초로 하여 산정할 수 있습니다. ○ 생계비는 채무자 및 피부양자의 인간다운 생활을 유지하기 위하여 필요한 금액으로서 국민기초생활보장법 제6조의 규정에 따라 공표된 최저생계비, 채무자 및 피부양자의 연령, 피부양자의 수, 거주지역, 물가상황 등을 종합적으로 고려하여 산정됩니다. "
개인회생>신청서작성및첨부서류>신청서(변제계획안등)작성및변경(수정)>Ⅱ.변제계획안작성의기준,개인회생가 살고 있는 집의 주택임차보증금 2000만원이 유일한 재산입니다. 이러한 경우에도 그 가치를 초과하여 변제하는 내용으로 변제계획안을 작성해야 하는지요?,"개인회생제도에서 변제계획안은 채무자가 파산하는 경우 채권자에게 배당할 수 있는 가치 즉, 청산가치 이상을 변제하는 내용으로 작성되어야 합니다(청산가치 보장의 원칙). 일반적으로 청산가치란 채무자의 재산 중 압류금지 재산을 공제한 가치를 의미하며, 이러한 압류금지 재산이 없는 한 일반적으로 채무자의 재산 평가액의 합계가 청산가치가 됩니다. 주택임대차보증금(임대주택의 보증금 포함)은 압류금지재산이 아니므로 역시 그 금액 이상을 변제해야 하며, 경우에 따라서는 청산가치를 보장하기 위해 변제기간을 연장할 수도 있습니다. 다만, 통합도산법은 채무자의 기초적인 생활유지의 기본인 주거생활의 안정과 최소한의 생계를 보장해주기 위해 면제재산제도를 두어, 주택임차보증금 중 일정 금액(면제할 수 있는 임차보증금반환청구권의 상한액은 주택임대차보호법 시행령 제3조제1항에서 정한 금액으로 하되, 그 금액이 주택가격의 2분의 1을 초과하는 경우에는 주택가격의 2분의 1로 함) 또는 6개월간의 생계비에 사용할 특정한 재산으로 일정한 금액을 청산가치에서 제외할 수 있도록 하였습니다. 채무자가 위 일정재산을 면제재산으로 인정받기 위해서는 개인회생 절차개시신청시부터 개인회생절차 개시결정 후 14일 이내까지 면제재산목록 및 소명자료를 첨부하여 법원에 신청해야 합니다. 면제재산의 상한액은 아래와 같습니다.    1. 주택임차보증금 중 다음을 초과하지 않는 금액    가.서울특별시: 5천500만원    나. 「수도권정비계획법」에 따른 과밀억제권역(서울특별시는 제외한다), 세종특별자치시, 용인시, 화성시 및 김포시: 4천800만원    다. 광역시(「수도권정비계획법」에 따른 과밀억제권역에 포함된 지역과 군지역은 제외한다), 안산시, 광주시, 파주시, 이천시 및 평택시: 2천800만원    라. 그 밖의 지역: 2천500만원   2. 6개월간의 생계비로 사용할 특정한 재산 중 1천110만원을 초과하지 않는 금액"
개인회생>신청서작성및첨부서류>신청서(변제계획안등)작성및변경(수정)>Ⅱ.변제계획안작성의기준,"개인회생로 부동산(아파트, 다세대 등 주택 또는 토지)이 있는데 개인회생을 신청하면 이 부동산을 팔아야 하나요?","통합도산법은 변제계획 인가요건으로서 청산가치 보장원칙을 제시하고 있습니다. 청산가치란 개인회생채권자가 갖고 있는 채권에 대하여 파산절차에서 배당받을 수 있는 가치를 말하며(총액기준으로 볼때 보통 채무자의 재산 합계액을 의미함), 개인회생에서는 이러한 청산가치를 보장하여 이를 상회하는 내용으로 변제계획안이 작성되어야 한다는 원칙을 청산가치 보장원칙이라고 합니다. 청산가치를 보장하는지 여부를 판단하기 위해서는 신청인이 변제계획의 수행을 통해 변제할 금원이 현재 재산 합계액을 초과하는지 비교하여 판단해야 하는데, 신청인이 변제계획을 통한 총변제예정액은 명목상의 합계액에 불과하고 중간이자를 감안하지 않은 금액이므로 단순히 명목상의 총변제예정액과 재산합계액을 비교해서는 안되며, 중간이자를 공제한 총변제예정액의 현재가치와 재산합계액을 비교하여 전자가 후자를 상회해야 청산가치가 만족되었다고 할 수 있습니다. 현재 법원은 라이프니찌 계수로 중간이자를 계산하여 청산가지 보장여부를 판단하고 있습니다.     만일, 채무자에게 부동산이 있어 청산가치가 많아 총변제예정액의 현재가치가 재산합계액을 초과하지 못할 경우, 신청인은 청산가치를 만족시키는 기간을 변제기간으로 정하여 변제계획안을 작성하여야 하고, 청산가치를 만족시키는 기간이 8년을 초과하는 경우 청산가치 만족을 위해 가용소득을 통한 변제 이외에 부동산을 처분하여 변제를 해야 합니다. 처분할 재산액은 청산가치에서 총변제예정액의 현재가치를 공제한 액수이며, 처분기간이 1년 이내인 경우 이에 1.3배, 처분기간이 2년 이내인 경우 이에 1.5배를 곱한 금액이 실제 변제투입예정액이 됩니다.     그러나 채무자에게 부동산이 있다 하더라도 근저당권이 설정되어 있거나 우선권 있는 세입자가 있는 경우가 대부분일 것이며, 이러한 경우 청산가치는 부동산의 시가에서 근저당권의 채권최고액이나 우선권 있는 보증금을 공제한 액수로 판단하고, 만일 부동산의 청산가치가 적은 경우 일반적으로 가용소득에 의한 변제만으로 청산가치를 만족시킬 수 있으므로 부동산을 처분할 필요는 없을 것입니다.     결론적으로, 근저당권 등으로 인해 채무자 부동산의 실제가치가 과소하다면 일반적으로 청산가치를 만족하게 되므로 부동산을 처분할 필요는 없을 것이나, 부동산의 실제가치가 많아 5년의 변제기간 동안 가용소득을 통한 총 변제예정액의 현재가치가 채무자의 재산 합계액을 초과하지 못한다면 그 부족분 만큼 부동산을 처분하여 변제해야 할 필요성이 있습니다. 구체적으로 재산처분을 통한 변제 여부를 판단하기 위해서는 시가, 근저당권 채권최고액, 임차보증금채권액, 총 변제예정액의 현재가치를 계산해 보아야 하며, 간이하게 알아보기 위해서는 개인회생자가진단(http://www.klac.or.kr/resu/resu/resu_c.php)을 통해 이를 예측할 수 있습니다."
개인회생>신청서작성및첨부서류>신청서(변제계획안등)작성및변경(수정)>Ⅱ.변제계획안작성의기준,개인회생신청 시 재산처분을 통한 변제도 해야 하는지,"개인회생제도는 채무자가 적법한 변제계획을 수립하여 법원으로부터 인가를 받으면 채권자들에 의한 개별적 강제집행의 위험에서 벗어날 수 있도록 하고 채무자가 변제계획을 성실히 수행하여 완료할 경우 잔존 채무를 면책시켜주는 갱생형 도산절차입니다. 따라서 개인회생절차에서는 최소한 파산절차에서 배당받을 수 있는 청산가치 이상의 변제를 보장해 주어야 한다는 원칙을 가지고 있으며, 「채무자 회생 및 파산에 관한 법률?은 동 원칙을 변제계획 인가요건으로 규정하고 있습니다(같은 법 제614조 제1항 제4호 및 제2항 제1호). 구체적으로는, 변제계획을 통해 채권자들에게 변제할 총 가용소득이 채무자가 개인회생절차개시결정 당시 보유한 재산 합계액을 상회하는지 여부로 청산가치가 보장되었는지를 판단하는데, 개인회생의 경우 일반적으로 매월 일정한 가용소득을 통해 5년의 변제기간 동안 변제를 하게 되므로 채무자가 변제하는 총 가용소득을 현재가치로 환산하여 그 금액이 채무자 재산 합계액 이상이 되어야 청산가치를 보장한다고 할 수 있습니다. 실무적으로는 현재가치 환산 방법으로 라이프니쯔식 현가 산정방식을 적용하는데 이러한 방식은 공제되는 중간이자가 복리로 계산되어 채권자들에게 유리합니다. 예를 들어 매월 20만원의 가용소득으로 60개월간 변제하는 내용으로 변제계획안을 작성하는 경우 명목상의 총 변제금은 금 1,200만원이나 라이프니쯔식 현가 산정방식을 통해 산정한 총 변제금의 현재가치는 금 10,728,660원{20만원×(3+50.6433)}(‘3’을 더하는 이유는 변제계획인가결정 전 일반적으로 미리 적립할 것으로 예상되는 개월 수이므로 할인하지 않은 것이며, ‘50.6433’은 나머지 57개월에 대한 라이프니쯔 계수를 의미함)이 되므로, 이러한 현재가치가 채무자가 개인회생절차 개시결정 당시 보유한 재산 합계액에 미달하는 경우 청산가치 보장의 원칙을 준수한 것으로 볼 수 없습니다. 이와 같은 경우 청산가치를 보장하기 위해서는 ①생계비를 줄여서 가용소득을 청산가치가 보장될 수 있을 정도로 늘리는 방법 ②가용소득 이외에 보유재산도 처분하는 것으로 변제계획안을 작성하는 방법이 있을 수 있습니다. ①의 방법의 경우 청산가치를 만족시키기 위해서는 생계비를 상당히 감액해야 하는데 법원에서 인정한 긴축된 생계비를 다시 줄이기는 쉽지 않은 것이 일반적이므로 보통 재산처분을 통한 변제계획안을 작성하여 청산가치를 만족시키고 있습니다. 구체적으로 청산가치를 보장하기 위하여 재산을 처분하는 내용으로 변제계획안을 작성하는 경우, 어떤 재산을 처분하고 얼마를 변제하는 것으로 작성하는지 문제될 수 있습니다. ①처분대상 재산은 채무자가 선택할 수 있으나 일정한 기간 내에 처분할 것으로 변제계획안을 작성해야 하므로 처분하기 쉬운 재산이어야 하고 청산가치를 만족시킬 수 있을 정도로 가치 있는 재산이어야 합니다. ②재산처분을 통한 변제액은 청산가치를 만족시킬 수 있는 금액이어야 하는 바, 구체적으로는 “채무자 재산 합계액(청산가치)과 총 가용소득의 현재가치와의 차액”이 청산가치를 만족시키지 못하는 금액이므로 동 금액 이상을 변제에 투입하는 것으로 변제계획안을 작성해야 합니다. 그러나 채무자에게 변제계획 인가결정과 동시에 재산을 처분하여 그 차액을 즉시 변제할 것을 기대하기는 어려우므로, 실무상 변제계획인가결정일로부터 1년 또는 2년의 변제기한을 주어서 그 기간 내에 변제하도록 하는 변제계획안을 작성하도록 하고 있습니다. 이러한 경우에도 가용소득을 통한 변제와 마찬가지로 재산처분을 통한 변제투입예정액의 현재가치를 산정하여 청산가치를 보장했는지 여부를 판단해야 하는 복잡한 문제가 발생하므로, 서울중앙지방법원 파산부 실무에서는 일률적으로 “청산가치와 총 가용소득의 현재가치의 차액”에 ①변제기한이 1년 이내인 경우에는 130%, ②변제기한이 2년 이내인 경우에는 150%의 곱한 금액을 재산처분을 통한 변제투입예정액으로 정할 수 있도록 하여 청산가치 보장원칙을 준수하도록 하고 있습니다.귀하의 경우 월평균 소득 180만원에서 2인 가구 생계비 금 158만원(보건복지부 공표 2015년 2인 가구 최저생계비 금 1,051,048원의 약 1.5배, 구체적 산정방법은 생계비 산정 사례 32번 참조)을 공제한 22만원을 가용소득으로 하여 60개월간 변제하는 내용으로 우선 변제계획안을 작성한다면, 총 가용소득의 현재가치가 금 11,801,526원{22만원×(3+50.6433)}에 불과하여 귀하의 재산 합계액(청산가치) 3,500만원에 미치지 못해 이를 상회하도록 가용소득을 늘리거나 재산처분을 통한 변제계획안을 작성해야 합니다. 재산처분을 통한 변제계획안을 작성하는 경우 ①영업소득을 기본 재산인 화물자동차를 처분대상재산으로 삼을 수 는 없으므로 상속받은 부동산을 처분대상재산으로 하되, ②변제투입예정액은 변제기한을 1년으로 할 경우 금10,631,855원{(35,000,000-26,821,650)×130%}, 2년으로 할 경우 금 12,267,525원{(35,000,000-26,821,650)×150%}으로 하여 변제계획안을 작성해야 합니다.“그런데, 처분대상재산 및 변제기한 등을 기재하는 것은 자금조달의 수단으로써 예시되는 것에 불과한 것이므로 변제계획에서 처분하기로 정한 재산이 아닌 다른 재산을 처분하였거나, 심지어 친족 등으로부터 금원을 융통하여 변제자금을 마련한다고 하더라도, 변제계획에서 정한 시기에 정한 금액을 변제에 투입하기만 한다면 결과적으로 문제될 것은 없습니다.”(서울중앙지방법원 파산부. 개인회생사건 유형별 사례집. 서울중앙지방법원(2004) P.30 참조)."
개인회생>신청서작성및첨부서류>신청서(변제계획안등)작성및변경(수정)>Ⅱ.변제계획안작성의기준,개인회생신청시 가용소득과 관련한 월평균 소득의 산정방법이나 그 소명자료는 어떻게 되나요.,"급여소득자의 월 평균 소득은 매월 수령하는 급여 및 특정 월에만 수령하는 상여금, 성과급 등을 합산한 금액을 평균하여 산정하며 이는 사용자가 발행한 급여명세서나 근로소득원천징수영수증, 급여통장의 기재로 소명할 수 있습니다. 영업소득자의 경우 신고소득을 신빙하기 어려운 경우가 많으므로 법원은 신고소득의 성실성을 판단하기 위해 최근의 고용형태별근로실태조사보고서의 유사직종 부분 사본을 제출하게 하고 있습니다.통상적으로 소득에 관한 자료가 부실하거나 내용이 일부 누락되는 등으로 신빙성이 없다고 판단될 경우 ‘수입상황 보고요구서 및 수입상황 보고서’(법원양식)를 통해 위와 같은 사실을 경고하고 수입상황을 보고하도록 할 수 있으며, 특히 영업소득자의 경우 개인회생위원은 영업 수지표를 작성하여 그에 따른 월평균수입을 소명하도록 요청하는 경우가 많습니다."
개인회생>신청서작성및첨부서류>신청서(변제계획안등)작성및변경(수정)>Ⅱ.변제계획안작성의기준,개인회생신청시 재산을 처분하여 변제해야 할 수도 있나요.,"개인회생과 관련하여, 채무자 회생 및 파산에 관한 법률 제614조 제1항 제4호에 의하면, 변제계획의 인가결정일을 기준일로 하여 평가한 개인회생채권에 대한 총변제액이 채무자가 파산하는 때에 배당받을 총액보다 적지 아니할 것을 변제계획인가결정의 요건으로 규정하고 있으므로(청산가치 보장의 원칙), 따라서 가용소득에 의한 변제만으로는 위와 같은 청산가치 보장의 원칙이 충족되지 아니하는 경우에는 재산을 일부 또는 전부 처분하여 변제재원으로 투입하는 방법으로 청산가치 보장의 원칙을 충족시켜야 변제계획에 대한 인가를 받을 수 있습니다."
개인회생>신청서작성및첨부서류>신청서(변제계획안등)작성및변경(수정)>Ⅱ.변제계획안작성의기준,개인회생에서 생계비는 어떻게 산정하나요?,개인회생에서 최저생계비는 기준중위소득의 60% 금액입니다. 다만 법원은 회생신청인 및 채권자들의 사정을 고려하여 탄력적으로 조정하고 있습니다.
