법률분류,기본질문,기본답변
주택·상가임대차>상가임대차>기타상가임대차>Ⅲ.임차물의전대,전차인도 상가임대차보호법상 최우선변제권을 행사할 수 있는지,귀하가 상가임대차보호법상 대항력을 갖춘 임차인과 임대인의 동의를 얻어 적법하게 전대차계약을 체결한 경우라면 원래의 임차인이 갖는 임차권의 대항력은 소멸하지 아니하고 동일성을 유지한 채로 존속한다고 보아야 하므로 임차인의 소액임차인 최우선변제권을 행사할 수 있을 것으로 보입니다.
주택·상가임대차>상가임대차>기타상가임대차>Ⅲ.임차물의전대,전차인에게도 상가건물임대차보호법이 적용되는지,「상가임대차보호법」 제13조 제2항의 임대인의 동의를 받고 전대차계약을 체결한 전차인에 해당한다 할 것이므로 귀하께서는 임차인의 임대인에 대한 계약갱신요구권 행사기간 범위 내에서 임차인을 대위하여 임대인에게 계약갱신요구권을 행사할 수 있을 것으로 보입니다.
주택·상가임대차>상가임대차>기타상가임대차>Ⅲ.임차물의전대,전차인의 계약갱신요구권,"계약갱신요구권이란, 임차인이 임대차기간만료 전 6월부터 1월까지 사이에 행하는 계약갱신요구에 대하여 임대인이 정당한 사유 없이 이를 거절할 수 없는 권리를 말합니다(상가건물임대차보호법 제10조 제1항 본문). 다만, 임차인의 계약갱신요구권도 최초의 임대차기간을 포함한 전체 임대차계약기간이 5년을 초과하지 않는 범위 내에서만 행사할 수 있습니다(상가건물임대차보호법 제10조 제2항). 한편, 상가건물임대차보호법은 임대인의 동의를 얻어 전대차한 전차인의 보호를 위해 계약갱신요구권을 인정하고 있습니다. 즉, 임대인의 동의를 받고 전대차계약을 체결한 전차인은 임차인의 계약갱신요구권 행사기간 이내에 임차인을 대위하여 임대인에게 계약갱신요구권을 행사할 수 있습니다(상가건물임대차보호법 제13조 제2항). 따라서 사안의 경우에 전차인은 임차인을 대위하여 임대인에게 계약갱신요구권을 행사할 수 있을 것으로 보입니다. 다만  이는 임차인의 계약갱신요구권을 대위 행사하는 것에 불과하므로 임차인이 계약갱신요구권을 행사하지 못할 사정이 있다면 전차인으로서도 위 권리를 행사하지 못할 수도 있습니다."
주택·상가임대차>상가임대차>기타상가임대차>Ⅵ.상가건물임대차표준계약서사용,상가건물임대차표준계약서의 용도,"상가건물 임대차보호법 제4조에 따라 법무부장관은 보증금, 차임액, 임대차기간, 수선비 분담 등의 내용이 기재된 상가건물임대차표준계약서를 정하여 그 사용을 권장하고 있습니다."
주택·상가임대차>상가임대차>대항력>Ⅰ.대항력의의의,가족명의로 상가임대차계약을 변경시 대항력문제,"1. 대항력의 취득 상가건물임대차보호법 제3조 제1항에 따르면 ‘임대차는 그 등기가 없는 경우에도 임차인이 건물의 인도와 「부가가치세법」 제8조, 「소득세법」 제168조 또는 「법인세법」 제111조에 따른 사업자등록을 신청하면 그 다음 날부터 제3자에 대하여 효력이 생긴다.’고 규정하고 있습니다. 따라서 대항력을 유지하기 위해서는 ‘인도’와 ‘사업자등록’이 필요합니다. 법원은 두 개 모두가 있어야만 대항력을 인정함을 원칙으로 하고 있습니다. 따라서 임대차계약을 아들 명의로 바꾸실 경우 대항력을 잃으실 수도 있습니다.  상가건물임대차보호법은 아니고 주택임대차보호법에 관한 판례 중 가족의 주민등록도 계약 당사자의 주민등록으로 본 예외적인 판례가 있으나 이 경우에도 가족이 함께 거주하고 있었는바(대판 1996.1.26. 95다30338), 이 사안에 바로 적용될 수 있는 것은 아닌 것으로 보입니다.  또한 사업자등록은 대항력 또는 우선변제권의 취득요건일 뿐만 아니라 존속요건이기도 하므로 배당요구의 종기까지 존속하고 있어야 합니다(대판 2006.1.13. 2005다64002)  따라서 실제 영업을 하시는 어머니 명의로 임대차계약을 유지하는 것이 나아보입니다.  2. 최우선변제권  상가건물임대차보호법 제14조 제1항에 따르면 동법 제3조 제1항의 요건을 갖추어야 한다고 규정하고 있습니다. 즉 대항력이 유지되고 있어야 최우선변제도 받으실 수 있습니다. 따라서 아들 명의로 변경하여 대항력을 잃게 되면 비록 그 금액이 1000만원이라고 하더라도 우선변제를 받으실 수 없습니다."
주택·상가임대차>상가임대차>대항력>Ⅰ.대항력의의의,대항력은 무엇인가요?,"대항력이란 임차인이 임차건물의 양수인, 임대할 권리를 승계한 자, 기타 임차건물에 관하여 이해관계를 가진 자에 대하여 임대차의 내용을 주장할 수 있는 법률상의 권능을 의미합니다"
주택·상가임대차>상가임대차>대항력>Ⅰ.대항력의의의,상가건물임대차법에서 말하는 대항력은 어떤 의미인가요?," 대항력이란 임차인이 임차건물의 양수인, 임대할 권리를 승계한 자, 기타 임차건물에 관하여 이해관계를 가진 자에 대하여 임대차의 내용을 주장할 수 있는 법률상의 권능을 의미합니다. 즉, 임차건물의 양수인이 양도인인 임대인의 지위를 승계하게 되는 결과 임차인은 양수인에게 임대차의 내용을 주장할 수 있고, 제3자의 임차건물에 대한 침해에 대하여 방해배제청구권 등을 행사할 수 있으며, 확정일자를 구비하게 되면 우선변제권을 주장할 수 있습니다. 상가건물 임대차는 그 등기를 하지 않은 경우에도 임차인이 건물의 인도와 사업자등록을 신청하면 그 다음날부터 대항력이 생기게 됩니다."
주택·상가임대차>상가임대차>대항력>Ⅰ.대항력의의의,상가임대차계약서상 임차인의 명의를 변경하는 경우 대항력문제,임대차계약상 명의를 변경하는 경우 가족관계에 있다 하더라도 대항력과 우선변제권을 상실할 수 있습니다.
주택·상가임대차>상가임대차>대항력>Ⅰ.대항력의의의,상가임차인의 대항력 구비요건,임차인이 그 등기가 없는 경우에도 건물인도와 사업자등록을 신청하면 그 다음날부터 제3자에 대하여 대항력이 생기게 됩니다.
주택·상가임대차>상가임대차>대항력>Ⅰ.대항력의의의,상가임차인의 대항력과 구비요건,"상가임차인의 대항력이란,임차인이 상가건물에 입점을 하고 사업자등록을 신청한 날 그 다음날부터제3자에 대하여 대항할 수 있고 매매, 증여 등으로 임차건물의 소유자가변경되는 경우에도 임차권은 새로운 소유자에게 승계되는 것이므로임대차계약의 존속기간 동안은 임차건물에서 영업을 할 수 있는 권리를말합니다.  이에 관하여 '상가건물임대차보호법' 제3조 1항은 ""임대차는 그 등기가 없는경우에도 임차인이 건물의 인도와 부가가치세법 제5조, 소득세법 제168조 또는법인세법 제111조의 규정에 의한 사업자등록을 신청한 때에는 그 다음 날부터제3자에 대하여 효력이 생긴다."" 라고 규정하고 있고, 보증금의 회수에 관하여 같은 법 제5조 제1항 및 제2항은 ""① 임차인이 임차건물에대하여 보증금반환청구소송의 확정판결 그 밖에 이에 준하는 집행권원에 기한경매를 신청하는 경우에는 민사집행법 제41조의 규정에 불구하고 반대의무의 이행또는 이행의 제공을 집행개시의 요건으로 하지 아니한다.② 제3조 제1항의 대항요건을 갖추고 관할 세무서장으로부터 임대차계약서상의확정일자를 받은 임차인은 민사집행법에 의한 경매 또는 국세징수법에 의한공매 시 임차건물(임대인 소유의 대지를 포함한다)의 환가대금에서 후순위권리자그 밖의 채권자보다 우선하여 보증금을 변제받을 권리가 있다.③ 임차인은 임차건물을 양수인에게 인도하지 아니하면 제2항의 규정에 의한보증금을 수령할 수 없다."" 라고 규정하고 있습니다.  그러므로 상가임차인이 건물의 인도와 사업자등록을 신청한 때에는 임대인을비롯한 그 이후의 제3자에 대하여 임대차기간동안 그 건물에서 영업을 계속할수 있는 대항력을 취득하게 됩니다.  만일, 임차인이 건물인도와 사업자등록신청 전에 임차건물에 대하여 저당권이나가압류 등의 권리설정이 없었던 경우에는 임차보증금의 전액을 반환받을 때까지그 임차건물에서 퇴거당하지 않을 권리가 있습니다.  반면에, 임차인이 건물인도(입점)와 사업자등록을 하기 전에 당해 건물에 저당권이나가등기, 가처분등기가 이미 설정되어 있었고 그 후 건물이 경매로 소유자가 변경된경우 그에 대하여는 대항력이 없어 임차권을 주장할 수 없으므로 임차보증금을받지 못하고 퇴거당할 수도 있을 것입니다."
주택·상가임대차>상가임대차>대항력>Ⅰ.대항력의의의,우선변제요건의 존속기간,"상가건물임대차에 있어서 우선변제의 요건이 되는 사업자등록은 존속요건으로서, 배당요구의 종기까지 존속하여야 하는 것이고, 만약 그 이전에 사업자등록이 말소되면 더 이상 우선변제권을 가질 수 없게 됩니다. 따라서 폐업신고는 그 이후에 하여야 할 것으로 생각됩니다."
주택·상가임대차>상가임대차>대항력>Ⅰ.대항력의의의,임차인이 폐업신고를 한 후 같은 장소에서 다시 같은 상호 및 등록번호로 사업자등록을 한 경우에 기존의 우선변제권이 유지되는지 여부,"임차인이 폐업한 경우에는 그 사업자등록은 상가건물임대차보호법이 상가임대차의 공시방법으로 요구하는 적법한 사업자등록으로 볼 수 없으므로, 다시 같은 상호 및 등록번호로 사업자등록을 하더라도 기존의 상가임대차보호법상의 대항력 및 우선변제권이 그대로 유지된다고 볼 수 없습니다.관련 사안과 관련하여 우리 대법원은 “상가건물을 임차하고 사업자등록을 마친 사업자가 폐업한 경우에는 그 사업자등록은 상가건물임대차보호법이 상가임대차의 공시방법으로 요구하는 적법한 사업자등록이라고 볼 수 없으므로(대법원 2006. 1. 13. 선고 2005다64002 판결 참조) 그 사업자가 폐업신고를 하였다가 다시 같은 상호 및 등록번호로 사업자등록을 하였다고 하더라도 기존의 상가건물임대차보호법상의 대항력 및 우선변제권이 존속한다고 할 수 없다“고 판시한 바 있습니다(대법원 2006. 10. 13. 선고 2006다56299 판결).따라서 위 대법원 법리에 의할 때 안타깝지만 기존의 우선변제권이 존속한다고 할 수 없습니다."""
주택·상가임대차>상가임대차>대항력>Ⅰ.대항력의의의,"저는 甲소유 상가건물 중 2층의 10평 정도를 보증금 5,000만원에 월세 80만원으로 임차하여 입점하고 사업자등록을 갖춘 임차인입니다. 그런데 저는 임차기간 만료 시 임차보증금을 확실하게 돌려받기 위하여 임대인인 건물주 甲에게 임대차등기를 해 줄 것을 요구하였습니다. 건물주 甲은 임대차등기에 협조하지 않고 있는데 만일, 제가 임대차등기를 하지 않고 있던 중 위 상가건물이 경매된다면, 임차보증금 5,000만원은 되돌려 받기 어렵다고 들었습니다. 건물주인 甲의 협조를 얻어 임대차등기를 할 수 없다면 임차보증금을 보호받을 수 있는 방법은 없는지요?","상가임차인의 대항력이란, 임차인이 상가건물에 입점을 하고 사업자등록을 신청한 날 그 다음날부터 제3자에 대하여 대항할 수 있고 매매, 증여 등으로 임차건물의 소유자가 변경되는 경우에도 임차권은 새로운 소유자에게 승계되는 것이므로 임대차계약의 존속기간 동안은 임차건물에서 영업을 할 수 있는 권리를 말합니다.이에 관하여 「상가건물임대차보호법」 제3조 제1항은 “임대차는 그 등기가 없는 경우에도 임차인이 건물의 인도와 부가가치세법 제8조, 소득세법 제168조 또는 법인세법 제111조에 따른 사업자등록을 신청하면 그 다음 날부터 제3자에 대하여 효력이 생긴다.”라고 규정하고 있고, 보증금의 회수에 관하여 같은 법 제5조 제1항, 제2항 및 제3항은 “①임차인이 임차건물에 대하여 보증금반환청구소송의 확정판결 그 밖에 이에 준하는 집행권원에 의하여 경매를 신청하는 경우에는 민사집행법 제41조에도 불구하고 반대의무의 이행이나 이행의 제공을 집행개시의 요건으로 하지 아니한다. ②제3조 제1항의 대항요건을 갖추고 관할 세무서장으로부터 임대차계약서상의 확정일자를 받은 임차인은 민사집행법에 따른 경매 또는 국세징수법에 따른 공매 시 임차건물(임대인 소유의 대지를 포함한다)의 환가대금에서 후순위권리자나 그 밖의 채권자보다 우선하여 보증금을 변제받을 권리가 있다. ③임차인은 임차건물을 양수인에게 인도하지 아니하면 제2항에 따른 의한 보증금을 받을 수 없다.”라고 규정하고 있습니다. 그러므로 상가임차인이 건물의 인도와 사업자등록을 신청한 때에는 임대인을 비롯한 그 이후의 제3자에 대하여 임대차기간동안 그 건물에서 영업을 계속할 수 있는 대항력을 취득하게 됩니다.만일, 임차인이 건물인도와 사업자등록신청 전에 임차건물에 대하여 저당권이나 가압류 등의 권리설정이 없었던 경우에는 임차보증금의 전액을 반환받을 때까지 그 임차건물에서 퇴거당하지 않을 권리가 있습니다. 반면에, 임차인이 건물인도(입점)와 사업자등록을 하기 전에 당해 건물에 저당권이나 가등기, 가처분등기가 이미 설정되어 있었고 그 후 건물이 경매로 소유자가 변경된 경우 그에 대하여는 대항력이 없어 임차권을 주장할 수 없으므로 임차보증금을 받지 못하고 퇴거당할 수도 있을 것입니다. 또한, 상가임차인이 건물을 인도받고 사업자등록을 신청하고 관할 세무서장으로부터 임대차계약서상의 확정일자까지 받은 경우, 일정한 요건 하에 일정한 금액을 한도로 하여 임차보증금에 대한 우선변제권이 있습니다."
주택·상가임대차>상가임대차>대항력>Ⅱ.대항력의요건(상가건물의인도),甲은 乙 소유의 상가 점포를 임대하여 사업자등록을 마쳤습니다. 그러나 여러 사정상 甲은 丙에게 점포를 전대하게 되었습니다. 이후 乙의 채권자들이 위 상가 점포에 대한 경매를 신청하여 경매 절차가 개시되었는데 이때 甲은 상가건물임대차보호법상의 대항력이 인정되어 우선변제권을 행사할 수 있는지요?,"「상가건물임대차보호법」 제3조 제1항은 “임대차는 그 등기가 없는 경우에도 임차인이 건물의 인도와 부가가치세법 제8조, 소득세법 제168조 또는 법인세법 제111조의 규정에 의한 사업자등록을 신청하면 그 다음 날부터 제3자에 대하여 효력이 생긴다.”라고 규정하고 있고, 같은 법 제5조 제2항은 “제3조제1항의 대항요건을 갖추고 관할 세무서장으로부터 임대차계약서상의 확정일자를 받은 임차인은 민사집행법에 따른 경매 또는 국세징수법에 의한 공매시 임차건물(임대인 소유의 대지를 포함한다)의 환가대금에서 후순위권리자나 그 밖의 채권자보다 우선하여 보증금을 변제받을 권리가 있다.”라고 규정하고 있습니다.따라서 위 사안의 경우와 같이 甲이 점포를 전대한 경우 상가임대차의 공시방법으로 요구하는 ‘사업자등록’이라는 요건을 충족하는지가 문제됩니다.이에 관하여 판례는 “상가건물의 임차인이 임대차보증금 반환채권에 대하여 상가건물 임대차보호법 제3조 제1항 소정의 대항력 또는 같은 법 제5조 제2항 소정의 우선변제권을 가지려면 임대차의 목적인 상가건물의 인도 및 부가가치세법 등에 의한 사업자등록을 구비하고, 관할세무서장으로부터 확정일자를 받아야 하며, 그 중 사업자등록은 대항력 또는 우선변제권의 취득요건일 뿐만 아니라 존속요건이기도 하므로, 배당요구의 종기까지 존속하고 있어야 한다.”고 하면서 “부가가치세법 제5조 제4항, 제5항의 규정 취지에 비추어 보면, 상가건물을 임차하고 사업자등록을 마친 사업자가 임차 건물의 전대차 등으로 당해 사업을 개시하지 않거나 사실상 폐업한 경우에는 그 사업자등록은 부가가치세법 및 상가건물 임대차보호법이 상가임대차의 공시방법으로 요구하는 적법한 사업자등록이라고 볼 수 없고, 이 경우 임차인이 상가건물 임대차보호법상의 대항력 및 우선변제권을 유지하기 위해서는 건물을 직접 점유하면서 사업을 운영하는 전차인이 그 명의로 사업자등록을 하여야 한다.”고 하였습니다(대법원 2006. 1. 13. 선고 2005다64002 판결).따라서 甲이 사실상 폐업하고 그 점포를 丙에게 전대한 경우, 건물을 직접 점유하면서 사업을 운영하는 전차인 丙이 그 명의로 사업자등록을 적법하게 하였다면 임차인 甲이 「상가건물임대차보호법」상의 대항력과 우선변제권을 계속 유지하고 있다고 할 것이지만, 전차인 丙이 그 명의로 사업자등록을 하지 않은 경우라면 임차인인 甲의 대항력 및 우선변제권은 유지될 수 없을 것입니다. "
주택·상가임대차>상가임대차>대항력>Ⅱ.대항력의요건(상가건물의인도),배당요구 종기까지 적법한 사업자등록이 유지되지 않은 경우의 우선변제권,귀하께서 사실상 분식코너 영업을 폐업함으로써 귀하의 사업자등록은 부가가치세법 및 상가건물임대차보호법이 상가건물 임대차의 공시방법으로 요구하는 적법한 사업자등록으로 볼 수 없게 되었으므로 귀하가 경매절차에서 우선변제권을 행사하는 것은 어려울 것으로 생각됩니다.
주택·상가임대차>상가임대차>대항력>Ⅱ.대항력의요건(상가건물의인도),사실상 폐업의 경우 우선변제권 유지방법,임차인이 상가건물 임대차보호법상의 대항력 및 우선변제권을 유지하기 위해서는 건물을 직접 점유하면서 사업을 운영하는 전차인이 그 명의로 사업자등록을 하여야 할 것입니다.
주택·상가임대차>상가임대차>대항력>Ⅱ.대항력의요건(상가건물의인도),"상가건물을 임차하고 사업자등록을 마친 사업자가 임차 건물의 전대차등으로 당해 사업을 개시하지 않거나 사실상 폐업한 경우, 임차인이 상가건물임대차보호법상의 대항력 및 우선변제권을 유지하기 위한 방법은 어떤 것이 있나요?",상가건물을 임차하고 사업자등록을 마친 사업자가 임차 건물의 전대차 등으로 당해 사업을 개시하지 않거나 사실상 폐업한 경우에는 그 사업자등록은 부가가치세법 및 상가건물 임대차보호법이 상가임대차의 공시방법으로 요구하는 적법한 사업자등록이라고 볼 수 없습니다. 따라서 이 경우 임차인이 상가건물 임대차보호법상의 대항력 및 우선변제권을 유지하기 위해서는 건물을 직접 점유하면서 사업을 운영하는 전차인이 그 명의로 사업자등록을 하여야 할 것입니다.(대법원 2006. 1. 13. 선고 2005다64002 판결 참조)
주택·상가임대차>상가임대차>대항력>Ⅱ.대항력의요건(상가건물의인도),상가를 전대한 임차인의 우선변제권 행사 가능 여부,"임차인이 사실상 폐업하고 그 점포를 전차인에게 전대한 경우, 건물을 직접 점유하면서 사업을 운영하는 전차인이 그 명의로 사업자등록을 적법하게 하였다면 임차인은 「상가건물임대차보호법」상의 대항력과 우선변제권을 계속 유지할 수 있지만, 전차인이 그 명의로 사업자등록을 하지 않은 경우라면 임차인인 귀하의 대항력 및 우선변제권은 유지될 수 없을 것입니다."
주택·상가임대차>상가임대차>대항력>Ⅱ.대항력의요건(상가건물의인도),상가임대차계약서와 다른 층을 임차하여 사용 시 대항력 유무,실제 임차목적물과 임대차계약서 및 사업자등록증상 임차목적물 소재가 불일치하여 상가건물임대차보호법상 대항력을 인정받기 어려울 것으로 보입니다.
주택·상가임대차>상가임대차>대항력>Ⅲ.대항력의요건(사업자등록),"甲은 집합건물로서 ‘○○시 ○○구 ○○동 3층 304호’ 등 3층 304호 내지 310호, 4층 401호 내지 410호, 5층 501호 내지 510호로 구분 등기되어 사우나시설로 사용중인 이 사건 각 부동산에서 음료 등의 판매업을 할 목적으로 2003. 8. 4. 임대인과 사이에 임대차계약서상 임대차목적물을 ‘위  3-5층 8.3평’으로 표시하여 임대차계약을 체결하고 사업자등록을 하면서도 사업장 소재지를 이와 같이 표시하고 위 임대차계약서를 첨부한 경우 상가건물 임대차보호법 제3조 제1항에 따른 사업자등록으로서 대항력을 가질 수 있나요?","상가건물 임대차보호법상 대항력을 취득하기 위하여는 동법 제3조 제1항에 따라 상가건물의 인도와 사업자등록이라는 대항요건을 구비하여야 합니다.그 중 사업자등록과 관련하여 우리 대법원은 “상가건물임대차보호법 제4조 와 그 시행 령 제3조 및 부가가치세법 제5조 와 그 시행 령 제7조 (소득세법 및 법인세법상의 사업자등록에 준용)에 의하면, 건물의 임대차에 이해관계가 있는 자는 건물의 소재지 관할 세무서장에게 임대차와 사업자등록에 관한 사항의 열람 또는 제공을 요청할 수 있고, 사업자가 사업장을 임차한 경우에는 사업자등록신청서에 임대차계약서 사본을 첨부하도록 하여 임대차에 관한 사항의 열람 또는 제공은 첨부한 임대차계약서의 기재에 의하도록 하고 있으므로, 사업자등록신청서에 첨부한 임대차계약서상의 임대차목적물 소재지가 당해 상가건물에 대한 등기부상의 표시와 불일치하는 경우에는 특별한 사정이 없는 한 그 사업자등록은 제3자에 대한 관계에서 유효한 임대차의 공시방법이 될 수 없다.”라고 판시한 바 있습니다(대법원 2008. 9. 25. 선고 2008다44238 판결).   따라서 위 대법원 법리에 의할 때 본 사안은 사업자등록신청서에 첨부한 임대차계약서상의 임대차목적물 소재지가 당해 상가건물에 대한 등기부상의 표시와 불일치하는 경우에 해당하므로 유효한 임대차 공시방법이라고 볼 수 없어 상가건물 임차인 甲은 상가건물 임대차보호법상의 대항력을 취득하지 못합니다."
주택·상가임대차>상가임대차>대항력>Ⅲ.대항력의요건(사업자등록),사업자등록신청서에 첨부한 임대차계약서와 실제계약내용이 다를 경우,사업자등록신청서에 첨부한 임대차계약서의 보증금액이 상가건물임대차보호법의 적용범위를 벗어난 경우 우선변제권의 행사가 불가합니다.
주택·상가임대차>상가임대차>대항력>Ⅲ.대항력의요건(사업자등록),상가건물 임대차보호법상 대항력을 인정받기 위하여 사업자등록이 갖추어야 할 요건,"상가건물임대차보호법상 대항력을 취득하기 위하여는 동법 제3조 제1항에 따라 상가건물의 인도와 사업자등록이라는 대항요건을 구비하여야 하고, 사업자등록시 사업자등록신청서에 첨부한 임대차계약서 상의 임대차목적물 소재지가 당해 상가건물에 대한 등기부상의 표시와 일치해야 합니다."
주택·상가임대차>상가임대차>대항력>Ⅲ.대항력의요건(사업자등록),임대차계약 변경 후 사업자등록정정신고를 하지 아니한 경우,귀하는 사업자등록정정신고를 하지 않으면 우선변제권을 행사할 수 없을 것으로 보입니다.
